{"stage":"code","status":"ready_for_review","summary":"Concurrent PR #106 merged exact main ef25cab94f8faec1d9824cc21f868b0b578858e4 with a dedicated fail-closed poll-only capability classifier that permits the missing-runtime path only for ad52dfcbc45d71eccad1d49fbd905161af7a44b1/v0.6.13. It supersedes the unpushed local issue #104 branch and automatically completed Release Verify and Publish Release for v0.6.13.","changed_files":["Makefile","hack/chart-poll-only-capability.py","hack/test-chart-poll-only-capability.py","hack/verify-chart-artifact.sh"],"validation":["PR #106 protected CI run 32891023093 passed all five required checks before merge.","Merged source binds the only missing-runtime exception to exact source ad52dfcbc45d71eccad1d49fbd905161af7a44b1 and version 0.6.13; other missing-runtime tuples fail closed.","Automatic Release 32892796207, Release Verify 32893956944, and Publish Release 32894855983 succeeded without manual tag, dispatch, rerun, or release creation.","Published v0.6.13 manifest binds source ad52dfcbc45d71eccad1d49fbd905161af7a44b1 and publisher ef25cab94f8faec1d9824cc21f868b0b578858e4.","Source ad52dfc is a verified descendant of Kafka fix 989799cc99a4e9577bfd100dde320a71f7e7fb9f; comparison is ahead by 1, behind by 0."],"blockers":[],"next_action":"Independently review exact merged PR #106 source, then run combined source and public-release validation before closing trackers and cleaning the superseded local branch.","route_to":"review","risk_level":"high"}
