{
  "stage": "test",
  "status": "pass",
  "summary": "Independent QA passed the exact reviewed snapshot across the full release-flow suite, coordinator policy fixtures, SemVer/idempotence tests, historical recovery, workflow linting, repository policy validation, and diff hygiene.",
  "changed_files": [],
  "validation": [
    "make test-release-flow: 107 unittest cases plus asset fixtures passed",
    "node hack/test-release-coordinator-policy.js: passed",
    "hack/test-release-plan.py: 10 tests passed",
    "hack/test-recover-release-attestations.py: 24 tests passed",
    "actionlint v1.7.7 across all workflows: passed",
    "hack/validate-repository.sh: passed",
    "git diff --check: passed",
    "diff SHA-256 unchanged: 4e4e94fafe09fdb1759a528d28be657c9b37edb4cfbe112278d0727f4d0d4e73"
  ],
  "blockers": [],
  "next_action": "Perform final pre-PR validation of acceptance coverage, repository state, and release-version expectation."
}
