{"stage":"code","status":"ready_for_review","summary":"Removed temporary Prune=false after verified chart adoption and updated ownership contract.","changed_files":["codex-stats/values.yaml","tests/test_codex_stats_dashboard.py"],"validation":["Focused tests 40 passed","Helm 0.1.6 lint and render passed","One-dashboard and no-standalone checks passed","YAML and diff checks passed"],"blockers":[],"next_action":"Review final cleanup PR #838 at b54abd0.","route_to":"review","risk_level":"high","independent_lanes":["Cleanup review"]}
