{"stage":"test","status":"pass","summary":"Independent exact-head release-readiness gate passed for chart/dashboard and ownership guard.","changed_files":[],"validation":["Dashboard tests 39 passed","Helm render contracts, lint, actionlint passed","Workflow and artifact contracts passed","Prometheus 26 rules and 6 fixtures passed","pve guard tests 38 passed","All required PR #200 hosted checks passed in run 33889054646"],"blockers":[],"next_action":"Perform staged GitOps validation: merge guard, verify live, then merge/publish chart.","route_to":"validation","risk_level":"high","independent_lanes":["Stage-one live guard verification","Chart merge and release verification"]}
