{"stage":"review","status":"pass","summary":"No blocking findings in merged PR #106 at ef25cab94f8faec1d9824cc21f868b0b578858e4. The exact legacy tuple is fail-closed, all prior artifact/provenance checks remain before capability classification, and workflows are unchanged. One P2 test-depth residual remains, mitigated by successful live verification/publication of the exact immutable artifact.","changed_files":[],"validation":["Reviewed ef25cab94f8faec1d9824cc21f868b0b578858e4 against f1ee15f8916cbb939e88e5a1491588d3b7a95f7d.","python3 hack/test-chart-poll-only-capability.py passed 4/4; python3 hack/test-release-chart-flow.py passed 6/6; make test-release-flow passed.","Release Verify 32893956944 verified exact ad52dfc source and cd7e023df18c9062335181af66e8e30bcf2f7d78cdc6ee23ed15a83e05b5e706 archive; Publish Release 32894855983 completed chart recheck and publication.","git diff --quiet f1ee15f..ef25cab -- .github/workflows passed; trusted workflow boundaries are unchanged."],"blockers":[],"next_action":"Run independent exact-main test suites and public-release validation; retain the P2 end-to-end regression-depth item as a follow-up rather than blocking the already-proven recovery.","route_to":"test","risk_level":"high","issues":[{"id":"REV7-TEST-001","title":"Merged capability tests are classifier-level rather than end-to-end verifier tests","severity":"medium","details":"The merged suite does not package a broken current poll-only chart or reproduce the exact source-era archive digest locally, although both paths have live successful evidence and the superseded local branch contains focused prototypes.","owner_stage":"test"}]}
