{
  "stage": "review",
  "status": "pass",
  "summary": "No blocking findings. Loop 2 baseline-only adjudication confirms unchanged HEAD 1d6d249, unchanged working-tree state, and no regression beyond the two pre-existing full-suite failures.",
  "changed_files": [],
  "validation": [
    "HEAD remains 1d6d2492021cfed0f7b7d975509a779485c8bfac; only the three pre-existing graphify-out files are dirty.",
    "Prior review-loop1 pass evidence was rechecked; it recorded no blocking findings and route_to=test for the same commit.",
    "Baseline report records identical two failures at f039009 and HEAD: Servarr synthetic exporter and Codicarium service bridge; changed-path exclusion remains clean.",
    "Targeted suite PYTHONPATH=. pytest -q tests/test_workspace_context_llm_proxy_gitops.py: 8 passed.",
    "git diff --check passed; protected worker, bridge, historical, Servarr, observability, and baseline-failure paths are unchanged.",
    "Current-run pipeline CI: ok=true, checked_runs=1, failed_runs=0, warnings=0."
  ],
  "blockers": [],
  "next_action": "Route to test through the pipeline controller; do not approve, deploy, sync Argo, restore, mutate source or cluster state, or handle secret values.",
  "route_to": "test",
  "risk_level": "high",
  "requires_council": true,
  "independent_lanes": [
    "Adjudicate baseline-only non-regression evidence for f039009 versus 1d6d249.",
    "Reconfirm targeted feature tests, diff/protected paths, and current-run CI."
  ]
}
