{
  "stage": "review",
  "status": "pass",
  "summary": "Independent exact-head review of PR #175 cleared the release smoke contract remediation.",
  "changed_files": [
    "Makefile",
    "tools/test_docker_smoke.py"
  ],
  "validation": [
    "Reviewed exact head 73d248b65a38cecd89f3cce6c0e3bb89256be793.",
    "Hosted validate run 32569271248 passed at the exact head.",
    "Focused Docker smoke contracts passed 11/11 under RELEASE_ARCHITECTURE=linux/amd64.",
    "Release immutable digest, architecture, and fail-closed guards remain intact.",
    "No blocking correctness, security, or regression findings."
  ],
  "blockers": [
    "Post-merge release publication and DEV rollout evidence are still required.",
    "The release workflow currently verifies linux/amd64 only; no arm64 claim is made."
  ],
  "next_action": "Run the exact-head QA gate, then merge PR #175 normally if repository checks remain green.",
  "route_to": "test",
  "risk_level": "low"
}
